Entity,Group,Value Name,Value Type,Value Position,Value,Rank,Start Time,End Time
Q43448,alias,language,zh,1,英属印度洋领地,,,
Q43448,alias,language,zh,2,英屬印度洋地區,,,
Q43448,alias,language,eu,1,Indiako Ozeanoko Lurralde Britainiarra,,,
Q43448,alias,language,bs,1,Britanski teritorij Indijskog okeana,,,
Q43448,alias,language,es,1,Territorio Británico en el Océano Indico,,,
Q43448,alias,language,es,2,Territorio Britanico del Oceano Índico,,,
Q43448,alias,language,es,3,Territorio Britanico en el Océano Índico,,,
Q43448,alias,language,es,4,Territorio Británico en el Oceano Indico,,,
Q43448,alias,language,es,5,Territorio Britanico en el Oceano Indico,,,
Q43448,alias,language,es,6,Territorio Britanico del Oceano Indico,,,
Q43448,alias,language,es,7,Territorios Británicos Del Océano Índico,,,
Q43448,alias,language,es,8,Territorio Britanico del Océano Índico,,,
Q43448,alias,language,es,9,British Indian Ocean Territory,,,
Q43448,alias,language,es,10,Territorio Británico del Oceano Indico,,,
Q43448,alias,language,es,11,Territorio Britanico en el Oceano Índico,,,
Q43448,alias,language,es,12,Territorio Británico del Océano Indico,,,
Q43448,alias,language,es,13,Territorio Británico del Oceano Índico,,,
Q43448,alias,language,es,14,Territorio Britanico en el Océano Indico,,,
Q43448,alias,language,es,15,Territorio Britanico del Océano Indico,,,
Q43448,alias,language,es,16,Islas Chagos,,,
Q43448,alias,language,es,17,Archipielago Chagos,,,
Q43448,alias,language,es,18,Territorio Británico en el Oceano Índico,,,
Q43448,alias,language,es,19,Territorio Británico en el Océano Índico,,,
Q43448,alias,language,ta,1,பிரித்தானிய இந்தியப் பெருங்கடல் பகுதி,,,
Q43448,alias,language,ta,2,பிரித்தானிய இந்து சம்முத்திர பகுதி,,,
Q43448,alias,language,af,1,Britse Indiese Oseaan Gebied,,,
Q43448,alias,language,hu,1,Chagos-szigetek,,,
Q43448,alias,language,sw,1,British Indian Ocean Territory,,,
Q43448,alias,language,el,1,Βρετανικό Έδαφος του Ινδικού Ωκεανού,,,
Q43448,alias,language,ar,1,British Indian Ocean Territory,,,
Q43448,alias,language,ar,2,منطقة المحيط الهندي البريطانية,,,
Q43448,alias,language,sv,1,Brittiskt territorium i Indiska Oceanen,,,
Q43448,alias,language,sv,2,Chagosöarna,,,
Q43448,alias,language,sv,3,Chagos,,,
Q43448,alias,language,sv,4,British Indian Ocean Territory,,,
Q43448,alias,language,nl,1,Brits Territorium in de Indische Oceaan,,,
Q43448,alias,language,nl,2,British Indian Ocean Territory,,,
Q43448,alias,language,nl,3,Brits Indische Oceaan Territorium,,,
Q43448,alias,language,su,1,British Indian Ocean Territory,,,
Q43448,alias,language,su,2,Teritorial Britania di Samudra Hindia,,,
Q43448,alias,language,su,3,Wewengkon Samudra India Britania,,,
Q43448,alias,language,ru,1,Британские территории в Индийском океане,,,
Q43448,alias,language,ru,2,Британская территория Индийского океана,,,
Q43448,alias,language,sr,1,Британска индијска океанска територија,,,
Q43448,alias,language,sr,2,Британска територија у Индијском океану,,,
Q43448,alias,language,tr,1,Britanya Hint Okyanusu Bölgesi,,,
Q43448,alias,language,tr,2,İngiliz Hint Okyanusu Bölgesi,,,
Q43448,alias,language,fi,1,BIOT,,,
Q43448,alias,language,fi,2,IOT,,,
Q43448,alias,language,fi,3,B.I.O.T.,,,
Q43448,alias,language,uk,1,Британські території в Індійському океані,,,
Q43448,alias,language,be-tarask,1,Брытанскія індыйска-акіянскія тэрыторыі,,,
Q43448,alias,language,nn,1,Det britiske territoriet i det indiske havet,,,
Q43448,alias,language,nn,2,British Indian Ocean Territory,,,
Q43448,alias,language,nn,3,The British Indian Ocean Territory,,,
Q43448,alias,language,hr,1,BIOT,,,
Q43448,alias,language,hr,2,Britanski teritorij Indijskog oceana,,,
Q43448,alias,language,hr,3,Britanski indijskooceanski teritoriji,,,
Q43448,alias,language,an,1,Territorio Britanico de l'Ozián Indico,,,
Q43448,alias,language,an,2,Territorio Britanico en l'Ocián Indico,,,
Q43448,alias,language,an,3,Territorio Britanico en l'Ozián Indico,,,
Q43448,alias,language,fr,1,Territoire britannique de l’Océan indien,,,
Q43448,alias,language,fr,2,Territoire britannique de l'ocean Indien,,,
Q43448,alias,language,fr,3,British Indian Ocean Territory,,,
Q43448,alias,language,fr,4,Territoires britanniques de l'océan Indien,,,
Q43448,alias,language,fr,5,BIOT,,,
Q43448,alias,language,he,1,הטריטוריות הבריטיות באוקיינוס ההודי,,,
Q43448,alias,language,bar,1,Britischs Territorium am Indischn Ozean,,,
Q43448,alias,language,yo,1,British Indian Ocean Territory,,,
Q43448,alias,language,yo,2,The British Indian Ocean Territory,,,
Q43448,alias,language,lv,1,Indijas Okeāna Britu Teritorija,,,
Q43448,alias,language,lv,2,BIOT,,,
Q43448,alias,language,lv,3,Indijas Okeāna Britu Teritorijas,,,
Q43448,alias,language,lv,4,IOT,,,
Q43448,alias,language,it,1,Territori Britannici dell'Oceano Indiano,,,
Q43448,alias,language,gl,1,Territorio Británico no Océano Índico,,,
Q43448,alias,language,id,1,The British Indian Ocean Territory,,,
Q43448,alias,language,id,2,Teritorial Britania Raya di Samudra Hindia,,,
Q43448,alias,language,id,3,Teritorial Britania di Samudra Hindia,,,
Q43448,alias,language,id,4,Teritorial Inggris di Samudera Hindia,,,
Q43448,alias,language,id,5,Teritorial Britania di Samudera Hindia,,,
Q43448,alias,language,id,6,Teritori Samudra Hindia Britania,,,
Q43448,alias,language,id,7,British Indian Ocean Territory,,,
Q43448,alias,language,de,1,British Indian Ocean Territory,,,
Q43448,alias,language,de,2,Brit.Geb.Ind.Oz,,,
Q43448,alias,language,ja,1,英領インド洋地域,,,
Q43448,alias,language,sh,1,Britanska indijska okeanska teritorija,,,
Q43448,alias,language,sh,2,Britanska Teritorija Indijskog Oceana,,,
Q43448,alias,language,sh,3,Britanska teritorija Indijskog okeana,,,
Q43448,alias,language,hy,1,Հնդկական օվկիանոսի բիրատանական տարածքներ,,,
Q43448,alias,language,ca,1,Territori Britànic de l’Oceà Índic,,,
Q43448,alias,language,ca,2,Territori Britànic en l'Oceà Índic,,,
Q43448,alias,language,ca,3,BIOT,,,
Q43448,alias,language,war,1,British Indian Ocean Territory,,,
Q43448,alias,language,sl,1,Britanski teritorij v Indijskem oceanu,,,
Q43448,alias,language,sl,2,Britanski indijskooceanski teritorij,,,
Q43448,alias,language,cs,1,Britské indooceánské teritorium,,,
Q43448,alias,language,cs,2,Britské indickooceánské teritorium,,,
Q43448,alias,language,cs,3,BIOT,,,
Q43448,alias,language,os,1,Индиаг фурды Бритайнаг территори,,,
Q43448,alias,language,os,2,Индийы фурды Стыр Британийы территори,,,
Q43448,alias,language,bg,1,Британска територия в Индийски океан,,,
Q43448,alias,language,bg,2,Архипелаг Чагос,,,
Q43448,alias,language,fa,1,قلمرو اقیانوس هند بریتانیا,,,
Q43448,alias,language,fa,2,قلمروی اقیانوس هند بریتانیا,,,
Q43448,alias,language,ur,1,British Indian Ocean Territory,,,
Q43448,alias,language,ur,2,برطانوی بحرھند کا خطہ,,,
Q43448,alias,language,ur,3,The British Indian Ocean Territory,,,
Q43448,alias,language,lt,1,Indijos vandenyno britų salos,,,
Q43448,alias,language,lt,2,Britanijos Indijos vandenyno teritorija,,,
Q43448,alias,language,lt,3,Britų Indijos vandenyno teritorija,,,
Q43448,alias,language,lt,4,Britų teritorija Indijos vandenyne,,,
Q43448,alias,language,nb,1,British Indian Ocean Territory,,,
Q43448,alias,language,nb,2,Britiske territorium i Indiahavet,,,
Q43448,alias,language,nb,3,Britisk territorium i Indiahavet,,,
Q43448,alias,language,nb,4,Britiske område i Indiahavet,,,
Q43448,alias,language,en,1,io,,,
,,,,,,,,
Q43448,description,language,nb,,britisk oversjøisk territorium i Indiahavet,,,
Q43448,description,language,en,,country in South Asia,,,
Q43448,description,language,hu,,"brit tengerentúli terület, Afrika és Indonézia között",,,
,,,,,,,,
Q43448,label,language,zh,,英屬印度洋領地,,,
Q43448,label,language,eu,,Indiako Ozeanoko Britainiar Lurraldea,,,
Q43448,label,language,pl,,Brytyjskie Terytorium Oceanu Indyjskiego,,,
Q43448,label,language,ang,,Bryttisca Indisca Garsecg Landscipe,,,
Q43448,label,language,bs,,Britanske indijskookeanske teritorije,,,
Q43448,label,language,es,,Territorio Británico del Océano Índico,,,
Q43448,label,language,ta,,பிரித்தானிய இந்தியப் பெருங்கடல் மண்டலம்,,,
Q43448,label,language,af,,Britse Indiese Oseaangebied,,,
Q43448,label,language,hu,,Brit Indiai-óceáni Terület,,,
Q43448,label,language,ms,,Wilayah Lautan Hindi British,,,
Q43448,label,language,sw,,Eneo la Uingereza katika Bahari Hindi,,,
Q43448,label,language,et,,Briti India ookeani ala,,,
Q43448,label,language,br,,Tiriad Meurvor Indez Breizh-Veur,,,
Q43448,label,language,el,,Βρετανικό Έδαφος Ινδικού Ωκεανού,,,
Q43448,label,language,rw,,Teritwari y’Inyanja y’Abahinde Nyongereza,,,
Q43448,label,language,ar,,إقليم المحيط الهندي البريطاني,,,
Q43448,label,language,sv,,Brittiska territoriet i Indiska oceanen,,,
Q43448,label,language,nl,,Brits Indische Oceaanterritorium,,,
Q43448,label,language,pt,,Território Britânico do Oceano Índico,,,
Q43448,label,language,eo,,Brita Hindoceana Teritorio,,,
Q43448,label,language,is,,Bresku Indlandshafseyjar,,,
Q43448,label,language,su,,Téritori Samudra Hindia Britania,,,
Q43448,label,language,ru,,Британская территория в Индийском океане,,,
Q43448,label,language,sr,,Британска територија Индијског океана,,,
Q43448,label,language,tr,,Britanya Hint Okyanusu Toprakları,,,
Q43448,label,language,fi,,Brittiläinen Intian valtameren alue,,,
Q43448,label,language,uk,,Британська територія в Індійському океані,,,
Q43448,label,language,be-tarask,,Брытанская тэрыторыя ў Індыйскім акіяне,,,
Q43448,label,language,nn,,Det britiske territoriet i Indiahavet,,,
Q43448,label,language,hr,,Britanski Indijskooceanski teritorij,,,
Q43448,label,language,an,,Territorio Britanico de l'Ocián Indico,,,
Q43448,label,language,ko,,영국령 인도양 지역,,,
Q43448,label,language,fr,,Territoire britannique de l'océan Indien,,,
Q43448,label,language,he,,הטריטוריה הבריטית באוקיינוס ההודי,,,
Q43448,label,language,be,,Брытанская тэрыторыя ў Індыйскім акіяне,,,
Q43448,label,language,ace,,Wilayah Inggréh di Samudra Hindia,,,
Q43448,label,language,bar,,Britischs Territorium im Indischn Ozean,,,
Q43448,label,language,yo,,Agbègbè Òkun Índíà Brítánì,,,
Q43448,label,language,lv,,Britu Indijas Okeāna Teritorija,,,
Q43448,label,language,it,,Territorio britannico dell'oceano Indiano,,,
Q43448,label,language,hif,,British Indian Ocean Territory,,,
Q43448,label,language,gl,,Territorio Británico do Océano Índico,,,
Q43448,label,language,id,,Wilayah Samudra Hindia Britania,,,
Q43448,label,language,de,,Britisches Territorium im Indischen Ozean,,,
Q43448,label,language,ja,,イギリス領インド洋地域,,,
Q43448,label,language,vi,,Lãnh thổ Ấn Độ Dương thuộc Anh,,,
Q43448,label,language,yue,,英屬印度洋領地,,,
Q43448,label,language,en,,British Indian Ocean Territory,,,
Q43448,label,language,sh,,Britanski teritorij Indijskog oceana,,,
Q43448,label,language,hi,,ब्रिटिश हिंद महासागर क्षेत्र,,,
Q43448,label,language,sk,,Britské indickooceánske územie,,,
Q43448,label,language,hy,,Հնդկական օվկիանոսի բրիտանական տարածքներ,,,
Q43448,label,language,ro,,Teritoriul Britanic din Oceanul Indian,,,
Q43448,label,language,th,,บริติชอินเดียนโอเชียนเทร์ริทอรี,,,
Q43448,label,language,ca,,Territori Britànic de l'Oceà Índic,,,
Q43448,label,language,cy,,Tiriogaeth Brydeinig Cefnfor India,,,
Q43448,label,language,war,,Teritoryo han Britanya ha Kalawdan Indyano,,,
Q43448,label,language,sl,,Britansko ozemlje v Indijskem oceanu,,,
Q43448,label,language,cs,,Britské indickooceánské území,,,
Q43448,label,language,os,,Индийы фурды Британийы территори,,,
Q43448,label,language,mr,,ब्रिटीश हिंदी महासागर क्षेत्र,,,
Q43448,label,language,bg,,Британска индоокеанска територия,,,
Q43448,label,language,fa,,قلمرو بریتانیا در اقیانوس هند,,,
Q43448,label,language,ur,,برطانوی بحرہند کا خطہ,,,
Q43448,label,language,ka,,ბრიტანეთის ინდოეთის ოკეანის ტერიტორია,,,
Q43448,label,language,lt,,Indijos Vandenyno Britų Sritis,,,
Q43448,label,language,nb,,Det britiske territoriet i Indiahavet,,,
Q43448,label,language,pa,,ਬਰਤਾਨਵੀ ਹਿੰਦ ਮਹਾਂਸਾਗਰ ਰਾਜਖੇਤਰ,,,
Q43448,label,language,lij,,Teritöio Britannego de l'Oçeano Indian,,,
Q43448,label,language,wuu,,英属印度洋领地,,,
Q43448,label,language,ky,,Инди океанындагы Британ территориясы,,,
Q43448,label,language,am,,የብሪታንያ ሕንድ ውቅያኖስ ግዛት,,,
Q43448,label,language,kk,,Үнді мұхитындағы Британия аймағы,,,
Q43448,label,language,az,,Britaniya Hind okeanı əraziləri,,,
Q43448,label,language,my,,ဗြိတိသျှ အိန္ဒိယသမုဒ္ဒရာ နယ်မြေ,,,
Q43448,label,language,ce,,Британин латта Индин океанехь,,,
Q43448,label,language,io,,Britaniana teritorio en Indiana Oceano,,,
Q43448,label,language,fy,,Britsk Yndyske Oseaanterritoarium,,,
,,,,,,,,
Q43448,claim,P17,wikibase-item,1,145,normal,,
Q43448,claim,P297,string,1,IO,normal,,
Q43448,claim,P298,string,1,IOT,normal,,
Q43448,claim,P299,string,1,086,normal,,
Q43448,claim,P373,string,1,British Indian Ocean Territory,normal,,
Q43448,claim,P41,commonsMedia,1,Flag of the British Indian Ocean Territory.svg,normal,,
Q43448,claim,P94,commonsMedia,1,Coat of arms of the British Indian Ocean Territory.svg,normal,,
Q43448,claim,P36,wikibase-item,1,184851,normal,,
Q43448,claim,P78,wikibase-item,1,44957,normal,,
Q43448,claim,P625,latitude,1,-6,normal,,
Q43448,claim,P625,longitude,1,71.5,normal,,
Q43448,claim,P85,wikibase-item,1,40807,normal,,
Q43448,claim,P910,wikibase-item,1,8912702,normal,,
Q43448,claim,P948,commonsMedia,1,Diego Garcia (BIOT) banner.jpg,normal,,
Q43448,claim,P242,commonsMedia,1,British Indian Ocean Territory on the globe (Afro-Eurasia centered).svg,normal,,
Q43448,claim,P163,wikibase-item,1,329280,normal,,
Q43448,claim,P237,wikibase-item,1,435431,normal,,
Q43448,claim,P38,wikibase-item,1,4917,normal,,
Q43448,claim,P474,string,1,+246,normal,,
Q43448,claim,P998,string,1,Regional/Asia/British_Indian_Ocean_Territory/,normal,,
Q43448,claim,P646,string,1,/m/0168b,normal,,
Q43448,claim,P901,string,1,IO,normal,,
Q43448,claim,P31,wikibase-item,1,1211529,normal,,
Q43448,claim,P1566,string,1,1282588,normal,,
Q43448,claim,P131,wikibase-item,1,46395,normal,,
,,,,,,,,
Q43448,sitelink,site,zhwiki,,英屬印度洋領地,,,
Q43448,sitelink,site,euwiki,,Indiako Ozeanoko Britainiar Lurraldea,,,
Q43448,sitelink,site,plwiki,,Brytyjskie Terytorium Oceanu Indyjskiego,,,
Q43448,sitelink,site,angwiki,,Bryttisca Indisca Garsecg Landscipe,,,
Q43448,sitelink,site,bswiki,,Britanske indijskookeanske teritorije,,,
Q43448,sitelink,site,eswiki,,Territorio Británico del Océano Índico,,,
Q43448,sitelink,site,tawiki,,பிரித்தானிய இந்தியப் பெருங்கடல் மண்டலம்,,,
Q43448,sitelink,site,afwiki,,Britse Indiese Oseaangebied,,,
Q43448,sitelink,site,huwiki,,Brit Indiai-óceáni Terület,,,
Q43448,sitelink,site,mswiki,,Wilayah Lautan Hindi British,,,
Q43448,sitelink,site,swwiki,,Eneo la Uingereza katika Bahari Hindi,,,
Q43448,sitelink,site,etwiki,,Briti India ookeani ala,,,
Q43448,sitelink,site,brwiki,,Tiriad Meurvor Indez Breizh-Veur,,,
Q43448,sitelink,site,elwiki,,Βρετανικό Έδαφος Ινδικού Ωκεανού,,,
Q43448,sitelink,site,rwwiki,,Teritwari y’Inyanja y’Abahinde Nyongereza,,,
Q43448,sitelink,site,arwiki,,إقليم المحيط الهندي البريطاني,,,
Q43448,sitelink,site,svwiki,,Brittiska territoriet i Indiska oceanen,,,
Q43448,sitelink,site,nlwiki,,Brits Indische Oceaanterritorium,,,
Q43448,sitelink,site,ptwiki,,Território Britânico do Oceano Índico,,,
Q43448,sitelink,site,eowiki,,Brita Hindoceana Teritorio,,,
Q43448,sitelink,site,iswiki,,Bresku Indlandshafseyjar,,,
Q43448,sitelink,site,suwiki,,Téritori Samudra Hindia Britania,,,
Q43448,sitelink,site,ruwiki,,Британская территория в Индийском океане,,,
Q43448,sitelink,site,srwiki,,Британска територија Индијског океана,,,
Q43448,sitelink,site,trwiki,,Britanya Hint Okyanusu Toprakları,,,
Q43448,sitelink,site,fiwiki,,Brittiläinen Intian valtameren alue,,,
Q43448,sitelink,site,ukwiki,,Британська територія в Індійському океані,,,
Q43448,sitelink,site,be_x_oldwiki,,Брытанская тэрыторыя ў Індыйскім акіяне,,,
Q43448,sitelink,site,nnwiki,,Det britiske territoriet i Indiahavet,,,
Q43448,sitelink,site,hrwiki,,Britanski Indijskooceanski teritorij,,,
Q43448,sitelink,site,anwiki,,Territorio Britanico de l'Ocián Indico,,,
Q43448,sitelink,site,kowiki,,영국령 인도양 지역,,,
Q43448,sitelink,site,frwiki,,Territoire britannique de l'océan Indien,,,
Q43448,sitelink,site,hewiki,,הטריטוריה הבריטית באוקיינוס ההודי,,,
Q43448,sitelink,site,bewiki,,Брытанская тэрыторыя ў Індыйскім акіяне,,,
Q43448,sitelink,site,acewiki,,Wilayah Inggréh di Samudra Hindia,,,
Q43448,sitelink,site,barwiki,,Britischs Territorium im Indischn Ozean,,,
Q43448,sitelink,site,yowiki,,Agbègbè Òkun Índíà Brítánì,,,
Q43448,sitelink,site,lvwiki,,Britu Indijas Okeāna Teritorija,,,
Q43448,sitelink,site,hifwiki,,British Indian Ocean Territory,,,
Q43448,sitelink,site,glwiki,,Territorio Británico do Océano Índico,,,
Q43448,sitelink,site,idwiki,,Wilayah Samudra Hindia Britania,,,
Q43448,sitelink,site,dewiki,,Britisches Territorium im Indischen Ozean,,,
Q43448,sitelink,site,jawiki,,イギリス領インド洋地域,,,
Q43448,sitelink,site,viwiki,,Lãnh thổ Ấn Độ Dương thuộc Anh,,,
Q43448,sitelink,site,zh_yuewiki,,英屬印度洋領地,,,
Q43448,sitelink,site,simplewiki,,British Indian Ocean Territory,,,
Q43448,sitelink,site,shwiki,,Britanski teritorij Indijskog oceana,,,
Q43448,sitelink,site,hiwiki,,ब्रिटिश हिंद महासागर क्षेत्र,,,
Q43448,sitelink,site,skwiki,,Britské indickooceánske územie,,,
Q43448,sitelink,site,hywiki,,Հնդկական օվկիանոսի բրիտանական տարածքներ,,,
Q43448,sitelink,site,enwiki,,British Indian Ocean Territory,,,
Q43448,sitelink,site,rowiki,,Teritoriul Britanic din Oceanul Indian,,,
Q43448,sitelink,site,nowiki,,Det britiske territoriet i Indiahavet,,,
Q43448,sitelink,site,thwiki,,บริติชอินเดียนโอเชียนเทร์ริทอรี,,,
Q43448,sitelink,site,cawiki,,Territori Britànic de l'Oceà Índic,,,
Q43448,sitelink,site,cywiki,,Tiriogaeth Brydeinig Cefnfor India,,,
Q43448,sitelink,site,warwiki,,Teritoryo han Britanya ha Kalawdan Indyano,,,
Q43448,sitelink,site,slwiki,,Britansko ozemlje v Indijskem oceanu,,,
Q43448,sitelink,site,cswiki,,Britské indickooceánské území,,,
Q43448,sitelink,site,oswiki,,Индийы фурды Британийы территори,,,
Q43448,sitelink,site,mrwiki,,ब्रिटीश हिंदी महासागर क्षेत्र,,,
Q43448,sitelink,site,bgwiki,,Британска индоокеанска територия,,,
Q43448,sitelink,site,fawiki,,قلمرو بریتانیا در اقیانوس هند,,,
Q43448,sitelink,site,urwiki,,برطانوی بحرہند خطہ,,,
Q43448,sitelink,site,kawiki,,ბრიტანეთის ინდოეთის ოკეანის ტერიტორია,,,
Q43448,sitelink,site,ltwiki,,Indijos Vandenyno Britų Sritis,,,
Q43448,sitelink,site,pawiki,,ਬਰਤਾਨਵੀ ਹਿੰਦ ਮਹਾਂਸਾਗਰ ਰਾਜਖੇਤਰ,,,
Q43448,sitelink,site,enwikivoyage,,British Indian Ocean Territory,,,
Q43448,sitelink,site,lijwiki,,Teritöio Britannego de l'Oçeano Indian,,,
Q43448,sitelink,site,hewikivoyage,,הטריטוריה הבריטית באוקיינוס ההודי,,,
Q43448,sitelink,site,wuuwiki,,英属印度洋领地,,,
Q43448,sitelink,site,commonswiki,,British Indian Ocean Territory,,,
Q43448,sitelink,site,kywiki,,Инди океанындагы Британ территориясы,,,
Q43448,sitelink,site,eswikivoyage,,Territorio Británico del Océano Índico,,,
Q43448,sitelink,site,amwiki,,የብሪታንያ ሕንድ ውቅያኖስ ግዛት,,,
Q43448,sitelink,site,kkwiki,,Үнді мұхитындағы Британия аймағы,,,
Q43448,sitelink,site,mywiki,,ဗြိတိသျှ အိန္ဒိယသမုဒ္ဒရာ နယ်မြေ,,,
Q43448,sitelink,site,azwiki,,Britaniya Hind okeanı əraziləri,,,
Q43448,sitelink,site,cewiki,,Британин латта Индин океанехь,,,
Q43448,sitelink,site,iowiki,,Britaniana teritorio en Indiana Oceano,,,
Q43448,sitelink,site,itwiki,,Territorio britannico dell'Oceano Indiano,,,
